{
  "receiver": "hermes-event-router",
  "status": "resolved",
  "groupKey": "incident/postiz-down",
  "title": "[RESOLVED] PostizDown",
  "state": "ok",
  "message": "The Postiz deployment recovered.",
  "alerts": [
    {
      "status": "resolved",
      "labels": {
        "alertname": "PostizDown",
        "team": "platform",
        "severity": "critical"
      },
      "annotations": {
        "summary": "Postiz recovered",
        "description": "Available replicas restored."
      },
      "startsAt": "2026-07-28T21:10:00Z",
      "endsAt": "2026-07-28T21:25:00Z",
      "fingerprint": "b7d1c1e2f3a4b5c6"
    }
  ]
}
